<?xml version="1.0" encoding="UTF-8"?>
<!DOCTYPE hyperalert[
	<!ELEMENT hyperalert 	(snort-id, pre, post)>
	<!ELEMENT snort-id 		(#PCDATA)>
	<!ELEMENT pre 			(#PCDATA)>
	<!ELEMENT post 		(#PCDATA)>
]>

